Company,City,State,County,Number,Ownership,Operator Name,Operator City,Operator State,Services 1,Services 2,Services 3,Services 4,Services 5,Services 6,Services 7,Services 8
HOME CARE &amp; HOSPICE,OLEAN,NY ,Cattaraugus, 716-492-0604, Voluntary Corporation,"COMMUNITY CARE OF WESTERN NEW YORK, INC.",OLEAN,N	 ,Audiology,Home Health Aide,Medical Social Services,Medical Supplies Equipment and Appliances,Nursing,Nutritional,Personal Care,Therapy - Occupational,Therapy - Physical,Therapy - Speech Language Pathology
HOME CARE &amp; HOSPICE,OLEAN,NY ,Cattaraugus, 716-372-2106, Voluntary Corporation,"COMMUNITY CARE OF WESTERN NEW YORK, INC.",OLEAN,N	 ,Audiology,Home Health Aide,Medical Social Services,Medical Supplies Equipment and Appliances,Nursing,Nutritional,Personal Care,Therapy - Occupational,Therapy - Physical,Therapy - Speech Language Pathology
HOME CARE &amp; HOSPICE,LITTLE VALLEY,NY ,Cattaraugus, 716-938-6097, Voluntary Corporation,"COMMUNITY CARE OF WESTERN NEW YORK, INC.",OLEAN,N	 ,Audiology,Home Health Aide,Medical Social Services,Medical Supplies Equipment and Appliances,Nursing,Nutritional,Personal Care,Therapy - Occupational,Therapy - Physical,Therapy - Speech Language Pathology
"ELDERCHOICE, INC.",ELBRIDGE,NY ,Cayuga, 315-252-7889, Proprietary Corporation,"ELDERCHOICE, INC.",ELBRIDGE,N	 ,Home Health Aide,Nursing,Personal Care
"NEW BEGINNINGS HOME CARE, INC.",AUBURN,NY ,Cayuga, 315-255-3390, Proprietary Corporation,"NEW BEGINNIINGS HOME CARE, INC.",AUBURN,N	 ,Home Health Aide,Homemaker,Nursing,Personal Care
"NORTH BROOK HEIGHTS HOME FOR ADULTS, INC.",AUBURN,NY ,Cayuga, 315-253-2755, Proprietary Corporation,"NORTH BROOK HEIGHTS HOME FOR ADULTS, INC.",AUBURN,N	 ,Home Health Aide,Nursing,Personal Care
"SIBLEY NURSING PERSONNEL SERVICE, INC",AUBURN,NY ,Cayuga, 315-474-1843, Proprietary Corporation,"EXCELLUS ACQUISITION, INC.",ROCHESTER,N	 ,Home Health Aide,Nursing,Personal Care
"STAFKINGS HEALTHCARE SYSTEMS, INC.",AUBURN,NY ,Cayuga, 315-252-3441, Proprietary Corporation,"STAFKINGS HEALTHCARE SYSTEMS, INC.",BINGHAMTON,N	 ,Home Health Aide,Nursing,Personal Care
"ACCREDITED CARE, INC.",JAMESTOWN,NY ,Chautauqua, 716-484-7101, Proprietary Corporation,"ACCREDITED CARE, INC.",JAMESTOWN,N	 ,Home Health Aide,Nursing,Nutritional,Personal Care,Therapy - Physical
"AFTERCARE NURSING SERVICES, INC.",JAMESTOWN,NY ,Chautauqua, 716-487-2279, Proprietary Corporation,"AFTERCARE NURSING SERVICE, INC.",CHEEKTOWAGA,N	 ,Home Health Aide,Nursing,Personal Care
CAREGIVERS,JAMESTOWN,NY ,Chautauqua, 716-483-9113, Proprietary Corporation,"HOMEMAKERS OF WESTERN NEW YORK, INC.",BUFFALO,N	 ,Home Health Aide,Nursing,Personal Care
"CHAUTAUQUA OPPORTUNITIES, INC.",DUNKIRK,NY ,Chautauqua, 716-366-3333, Voluntary Corporation,"CHAUTAUQUA OPPORTUNITIES, INC.",DUNKIRK,N	 ,Home Health Aide,Nursing,Personal Care
HULQUIST PLACE,JAMESTOWN,NY ,Chautauqua, 716-720-9600, Voluntary Corporation,"LUTHERAN HOUSING REALTY, INC.",JAMESTOWN,N	 ,Home Health Aide,Nursing
HULTQUIST PLACE,JAMESTOWN,NY ,Chautauqua, 716-720-9600, Voluntary Corporation,"LUTHERAN HOUSING REALTY, INC.",JAMESTOWN,N	 ,Home Health Aide,Nursing
JOHNSON HOME CARE AGENCY,FORESTVILLE,NY ,Chautauqua, 716-965-2644, Individual,RONALD R. JOHNSON,FREDONIA,N	 ,Home Health Aide,Nursing,Personal Care
JOHNSON LTD HOME CARE SERVICES AGENCY-FORESTVILLE,FREDONIA,NY ,Chautauqua, 716-672-8210, Individual,RONALD R. JOHNSON,FREDONIA,N	 ,Nursing,Personal Care
JOHNSON LTD HOME CARE SERVICES AGENCY-FREDONIA,FREDONIA,NY ,Chautauqua, 716-965-2644, Individual,RONALD R. JOHNSON,FREDONIA,N	 ,Nursing,Personal Care
"NEW VISION SERVICES, INC.",JAMESTOWN,NY ,Chautauqua, 716-664-3118, Voluntary Corporation,"NEW VISION SERVICES, INC.",JAMESTOWN,N	 ,Nursing,Personal Care
THE WOMEN'S CHRISTIAN ASSOCIATION,FREDONIA,NY ,Chautauqua, 716-672-7961, Voluntary Corporation,THE WOMEN'S CHRISTIAN ASSOCIATION,FREDONIA,N	 ,Home Health Aide,Homemaker,Housekeeper,Nursing,Personal Care
THE WOMEN'S CHRISTIAN ASSOCIATION,FREDONIA,NY ,Chautauqua, 716-672-7961, Voluntary Corporation,THE WOMEN'S CHRISTIAN ASSOCIATION,FREDONIA,N	 ,Nursing,Personal Care
VNA HOME CARE SERVICES,JAMESTOWN,NY ,Chautauqua, 716-484-3332, Voluntary Corporation,VNA HOME CARE SERVICES,WILLIAMSVILLE,N	 ,Home Health Aide,Nursing,Personal Care,Therapy - Occupational,Therapy - Physical,Therapy - Speech Language Pathology
AMERICARE,ELMIRA,NY ,Chemung, 607-732-3502, Proprietary Corporation,"STAFCARE OF NEW YORK, INC.",BINGHAMTON,N	 ,Home Health Aide,Nursing,Personal Care
BETHANY VILLAGE RETIREMENT,HORSEHEADS,NY ,Chemung, 607-739-8711, Voluntary Corporation,BETHANY VILLAGE,HORSEHEADS,N	 ,Nursing,Personal Care
CAREGIVERS,ELMIRA,NY ,Chemung, 607-739-3611, Proprietary Corporation,"HOMEMAKERS OF WESTERN NEW YORK, INC.",BUFFALO,N	 ,Home Health Aide,Nursing,Personal Care
COMMUNITY HOME CARE OF BETHANY VILLAGE,HORSEHEADS,NY ,Chemung, 607-739-8711, Voluntary Corporation,"BETHANY RETIREMENT HOME, INC.",HORSEHEADS,N	 ,Home Health Aide,Nursing,Personal Care
COMPREHENSIVE INTERDISCIPLINARY DEV SERVICES INC.,ELMIRA,NY ,Chemung, 607-733-6533, Voluntary Corporation,"COMPREHENSIVE INTERDISCIPLINARY DEV. SERVICES, INC",ELMIRA,N	 ,Nursing
"FAMILY SERVICES OF CHEMUNG COUNTY, INC.",ELMIRA,NY ,Chemung, 607-737-1351, Voluntary Corporation,"FAMILY SERVICES OF CHEMUNG COUNTY, INC.",ELMIRA,N	 ,Home Health Aide,Nursing,Personal Care
GENTIVA HEALTH SERVICES,CORNING,NY ,Chemung, 607-562-3637, Proprietary Corporation,"QUALITY CARE-USA, INC.",WESTBURY,N	 ,Home Health Aide,Medical Social Services,Nursing,Personal Care,Therapy - Occupational,Therapy - Physical,Therapy - Speech Language Pathology
"STAFKINGS HEALTHCARE SYSTEMS, INC.",ELMIRA,NY ,Chemung, 607-734-3646, Proprietary Corporation,"STAFKINGS HEALTHCARE SYSTEMS, INC.",BINGHAMTON,N	 ,Home Health Aide,Nursing,Personal Care
CHENANGO COUNTY PUBLIC HEALTH NURSING SERVICE,NORWICH,NY ,Chenango, 607-337-1660, Public,CHENANGO COUNTY PUBLIC HEALTH NURSING SERVICE,NORWICH,N	 ,Medical Social Services,Nursing,Nutritional
"FAMILY HOME CARE, INC.",SHERBURNE,NY ,Chenango, 607-674-6465, Proprietary Corporation,"FAMILY HOME CARE, INC.",ROME,N	 ,Home Health Aide,Nursing,Personal Care
"NORTH COUNTRY HOME SERVICES, INC.",PLATTSBURGH,NY ,Clinton, 518-566-0183, Voluntary Corporation,"NORTH COUNTRY HOME SERVICES, INC.",SARANAC LAKE,N	 ,Home Health Aide,Nursing,Personal Care
"ANGEL HOME HEALTH CARE, LLC",GERMANTOWN,NY ,Columbia, 518-537-2070, Limited Liability Company,"ANGEL HOME HEALTH CARE, LLC",GERMANTOWN,N	 ,Home Health Aide,Homemaker,Nursing,Personal Care
"ANY-TIME HOME CARE, INC.",HUDSON,NY ,Columbia, 518-828-0183, Proprietary Corporation,"ANY-TIME HOME CARE, INC.",NYACK,N	 ,Home Health Aide,Medical Social Services,Medical Supplies Equipment and Appliances,Nursing,Nutritional,Personal Care,Therapy - Occupational,Therapy - Physical,Therapy - Respiratory,Therapy - Speech Language Pathology
GREEN MANOR HOME CARE SERVICES AGENCY,GHENT,NY ,Columbia, 518-828-0800, Voluntary Corporation,"HUDSON VALLEY CARE CENTER, INC.",GHENT,N	 ,Home Health Aide,Nursing,Personal Care
GREEN MANOR LIMITED HOME CARE SERVICES AGENCY,GHENT,NY ,Columbia, 518-828-0800, Voluntary Corporation,"HUDSON VALLEY CARE CENTER, INC.",GHENT,N	 ,Nursing,Personal Care
"UNLIMITED CARE, INC.",HUDSON,NY ,Columbia, 518-828-7001, Proprietary Corporation,"UNLIMITED CARE, INC.",WHITE PLAINS,N	 ,Home Health Aide,Nursing,Personal Care,Therapy - Physical
"HOME CARE FOR CORTLAND COUNTY, INC.",CORTLAND,NY ,Cortland, 607-753-9326, Voluntary Corporation,"HOME CARE FOR CORTLAND COUNTY, INC.",CORTLAND,N	 ,Home Health Aide,Nursing,Personal Care
"ALLIED HOME CARE, INC.",POUGHKEEPSIE,NY ,Dutchess, 845-462-2646, Proprietary Corporation,"ALLIED HOME CARE, INC.",POUGHKEEPSIE,N	 ,Home Health Aide,Nursing,Personal Care
"ANY-TIME HOME CARE, INC.",POUGHKEEPSIE,NY ,Dutchess, 845-485-2666, Proprietary Corporation,"ANY-TIME HOME CARE, INC.",NYACK,N	 ,Audiology,Home Health Aide,Medical Social Services,Medical Supplies Equipment and Appliances,Nursing,Nutritional,Personal Care,Therapy - Occupational,Therapy - Physical,Therapy - Speech Language Pathology
COMPREHENSIVE HOME CARE,POUGHKEEPSIE,NY ,Dutchess, 845-473-7444, Proprietary Corporation,"ACCENTCARE OF NEW YORK, INC.",NEW ROCHELLE,N	 ,Home Health Aide,Homemaker,Housekeeper,Nursing,Personal Care
"FOUNTAINS HOME CARE OF NEW YORK, INC.",MILLBROOK,NY ,Dutchess, 845-214-0167, Proprietary Corporation,"FOUNTAINS HOME CARE OF NEW YORK, INC.",MILLBROOK,N	 ,Home Health Aide,Homemaker,Housekeeper,Medical Supplies Equipment and Appliances,Nursing,Personal Care
GOLDEN CARE LICENSED HOME CARE SERVICES AGENCY,POUGHKEEPSIE,NY ,Dutchess, 845-471-7930, Partnership,AZRIEL RECKESS AND PAULA RECKESS,HIGHLAND,N	 ,Home Health Aide,Nursing,Personal Care
"HUDSON VALLEY HOME CARE, INC.",POUGHKEEPSIE,NY ,Dutchess, 845-471-4243, Proprietary Corporation,"HUDSON VALLEY HOME CARE, INC.",POUGHKEEPSIE,N	 ,Home Health Aide,Medical Social Services,Medical Supplies Equipment and Appliances,Nursing,Nutritional,Personal Care,Therapy - Occupational,Therapy - Physical,Therapy - Respiratory,Therapy - Speech Language Pathology
MOUNTAINVIEW HOME CARE AGENCY,BEACON,NY ,Dutchess, 845-831-6000, Partnership,MOUNTAINVIEW HOME CARE AGENCY,BEACON,N	 ,Home Health Aide,Medical Supplies Equipment and Appliances,Nursing,Personal Care
MOUNTAINVIEW LIMITED HOME CARE AGENCY,BEACON,NY ,Dutchess, 845-838-3919, Partnership,MOUNTAINVIEW LIMITED HOME CARE AGENCY,BEACON,N	 ,Nursing,Personal Care
"PREMIER HOME HEALTH CARE SERVICES, INC.",WAPPINGERS FALLS,NY ,Dutchess, 845-214-0870, Proprietary Corporation,"PREMIER HOME HEALTH CARE SERVICES, INC.",WHITE PLAINS,N	 ,Home Health Aide,Nursing,Personal Care
ST. FRANCIS HOME CARE SERVICES CORPORATION,POUGHKEEPSIE,NY ,Dutchess, 845-483-5551, Voluntary Corporation,ST. FRANCIS HOME CARE SERVICES CORPORATION,POUGHKEEPSIE,N	 ,Audiology,Home Health Aide,Medical Social Services,Nursing,Personal Care,Therapy - Occupational,Therapy - Physical,Therapy - Respiratory,Therapy - Speech Language Pathology
"UNLIMITED CARE, INC.",RHINEBECK,NY ,Dutchess, 845-876-1976, Proprietary Corporation,"UNLIMITED CARE, INC.",WHITE PLAINS,N	 ,Home Health Aide,Nursing,Personal Care,Therapy - Physical
"UNLIMITED CARE, INC.",POUGHKEEPSIE,NY ,Dutchess, 845-473-5900, Proprietary Corporation,"UNLIMITED CARE, INC.",WHITE PLAINS,N	 ,Home Health Aide,Nursing,Personal Care,Therapy - Physical
VASSAR WARNER HOME,POUGHKEEPSIE,NY ,Dutchess, 845-454-3754, Voluntary Corporation,VASSAR WARNER HOME,POUGHKEEPSIE,N	 ,Home Health Aide,Nursing,Personal Care
"AFTERCARE NURSING SERVICES, INC.",CHEEKTOWAGA,NY ,Erie, 716-894-7777, Proprietary Corporation,"AFTERCARE NURSING SERVICE, INC.",CHEEKTOWAGA,N	 ,Home Health Aide,Nursing,Personal Care
"ALLCARE FAMILY SERVICES, INC.",BUFFALO,NY ,Erie, 716-884-1001, Proprietary Corporation,"ALLCARE FAMILY SERVICES, INC.",BUFFALO,N	 ,Home Health Aide,Nursing,Personal Care
ALTERNATIVE LIVING SERVICES INC,KENMORE,NY ,Erie, 716-874-3200, Proprietary Corporation,"ALTERNATIVE LIVING SERVICES HOME CARE, INC.",MANLIUS,N	 ,Home Health Aide,Nursing
AMAK HEALTH CARE AGENCY,BUFFALO,NY ,Erie, 716-832-0875, Proprietary Corporation,"AMAK HEALTH CARE AGENCY, INC.",BUFFALO,N	 ,Home Health Aide,Nursing,Personal Care
"ASSOCIATED HEALTHCARE SYSTEMS, INC.",BUFFALO,NY ,Erie, 716-886-7337, Proprietary Corporation,"ASSOCIATED HEALTHCARE SYSTEMS, INC.",BUFFALO,N	 ,Medical Supplies Equipment and Appliances,Nursing
"AURORA HOME CARE, INC.",CHEEKTOWAGA,NY ,Erie, 716-833-9000, Proprietary Corporation,"AURORA HOME CARE, INC.",CHEEKTOWAGA,N	 ,Nursing
"BROTHERS OF MERCY SACRED HEART HOME, INC.",CLARENCE,NY ,Erie, 716-759-2644, Voluntary Corporation,"BROTHERS OF MERCY SACRED HEART HOME, INC.",CLARENCE,N	 ,Home Health Aide,Nursing,Personal Care
CAREGIVERS,TONAWANDA,NY ,Erie, 716-838-6061, Proprietary Corporation,"HOMEMAKERS OF WESTERN NEW YORK, INC.",TONAWANDA,N	 ,Home Health Aide,Nursing,Personal Care
"CARING HEARTS HOME CARE, INC",CHEEKTOWAGA,NY ,Erie, 716-686-8300, Voluntary Corporation,"CARING HEARTS HOME CARE, INC.",CHEEKTOWAGA,N	 ,Audiology,Home Health Aide,Homemaker,Housekeeper,Medical Social Services,Medical Supplies Equipment and Appliances,Nursing,Nutritional,Personal Care,Physician Services,Therapy - Occupational,Therapy - Physical,Therapy - Respiratory,Therapy - Speech Language Pathology
CARING UNLIMITED,COLLINS,NY ,Erie, 716-725-4848, Individual,VICTORIA GREENE,COLLINS,N	 ,Home Health Aide,Nursing,Personal Care
DEPAUL HOME CARE,CHEEKTOWAGA,NY ,Erie, 716-608-7000, Voluntary Corporation,"DEPAUL ADULT CARE COMMUNITIES, INC.",ROCHESTER,N	 ,Home Health Aide,Nursing,Personal Care,Therapy - Occupational,Therapy - Physical,Therapy - Speech Language Pathology
DEPAUL HOME CARE,BUFFALO,NY ,Erie, 716-877-7171, Voluntary Corporation,"DEPAUL ADULT CARE COMMUNITIES, INC.",ROCHESTER,N	 ,Home Health Aide,Nursing,Personal Care,Therapy - Occupational,Therapy - Physical,Therapy - Speech Language Pathology
ELDERWOOD VILLAGE AT MAPLEWOOD LLC,CHEEKTOWAGA,NY ,Erie, 716-681-8631, Limited Liability Company,ELDERWOOD ASSISTED LIVING AT MAPLEWOOD LLC,CHEEKTOWAGA,N	 ,Home Health Aide,Nursing,Personal Care,Therapy - Occupational,Therapy - Physical,Therapy - Speech Language Pathology
ELDERWOOD VILLAGE AT WESTWOOD,WEST SENECA,NY ,Erie, 716-633-3900, Proprietary Corporation,"WESTWOOD VILLAGE, INC.",WILLIAMSVILLE,N	 ,Home Health Aide,Nursing,Therapy - Occupational,Therapy - Physical,Therapy - Speech Language Pathology
GOODCARE HOME HEALTH SERVICES,TONAWANDA,NY ,Erie, 716-833-3445, Proprietary Corporation,"GOODCARE HOME HEALTH SERVICES, INC.",TONAWANDA,N	 ,Home Health Aide,Nursing,Personal Care
HEALTH FORCE,CHEEKTOWAGA,NY ,Erie, 716-855-2273, Proprietary Corporation,"CARING ENTERPRISES, INC.",CHEEKTOWAGA,N	 ,Home Health Aide,Nursing,Personal Care
HOMEWATCH CAREGIVERS,WILLIAMSVILLE,NY ,Erie, 716-565-3103, Proprietary Corporation,"COMPASS HOME SERVICES, LLC",WILLIAMSVILLE,N	 ,Home Health Aide,Nursing,Personal Care,Therapy - Occupational,Therapy - Physical
"INDEPENDENT NURSING CARE, LLC",WEST FALLS,NY ,Erie, 716-655-8776, Limited Liability Company,INDEPENDENT NURSING CARE LLC,WEST FALLS,N	 ,Home Health Aide,Housekeeper,Medical Social Services,Medical Supplies Equipment and Appliances,Nursing,Nutritional,Personal Care,Therapy - Occupational,Therapy - Physical,Therapy - Respiratory,Therapy - Speech Language Pathology
INTERIM HEALTH CARE OF BUFFALO,BUFFALO,NY ,Erie, 716-852-5900, Proprietary Corporation,H. C. WATSON CORPORATION,BUFFALO,N	 ,Home Health Aide,Medical Supplies Equipment and Appliances,Nursing,Personal Care
"LIKEN HEALTH CARE, INC.",WILLIAMSVILLE,NY ,Erie, 716-929-1427, Proprietary Corporation,"LIKEN HEALTH CARE, INC.",PITTSBURGH,N	 ,Home Health Aide,Nursing,Personal Care
"MAXIM OF NEW YORK, LLC",BUFFALO,NY ,Erie, 716-881-2800, Limited Liability Company,"MAXIM OF NEW YORK, LLC",WHITE PLAINS,N	 ,Home Health Aide,Homemaker,Housekeeper,Nursing,Personal Care
"MENORAH CAMPUS ADULT HOME, INC.",GETZVILLE,NY ,Erie, 716-639-3311, Voluntary Corporation,"MENORAH CAMPUS ADULT HOME, INC.",GETZVILLE,N	 ,Home Health Aide,Homemaker,Housekeeper,Nursing,Personal Care
"MENORAH CAMPUS ADULT HOME, INC.",BUFFALO,NY ,Erie, 716-250-3131, Voluntary Corporation,"MENORAH CAMPUS ADULT HOME, INC.",GETZVILLE,N	 ,Home Health Aide,Nursing,Personal Care
MERCY HOME CARE OF WESTERN NEW YORK,LACKAWANNA,NY ,Erie, 716-819-5012, Voluntary Corporation,"NIAGARA HOMEMAKER SERVICES, INC.",CHEEKTOWAGA,N	 ,Home Health Aide,Medical Social Services,Nursing,Nutritional,Therapy - Occupational,Therapy - Physical,Therapy - Speech Language Pathology
"NEW FRONTIERS IN T.B.I., INC.",BUFFALO,NY ,Erie, 716-826-6245, Proprietary Corporation,"NEW FRONTIERS IN T.B.I., INC.",BUFFALO,N	 ,Home Health Aide,Homemaker,Housekeeper,Nursing,Personal Care
OPTION CARE,ORCHARD PARK,NY ,Erie, 800-879-6137, Proprietary Corporation,"SPRINGVILLE PHARMACY INFUSION THERAPY, INC.",ORCHARD PARK,N	 ,Medical Supplies Equipment and Appliances,Nursing,Nutritional
PEDIATRIC SERVICES OF AMERICA,AMHERST,NY ,Erie, 716-276-2123, Proprietary Corporation,PSA HEALTHCARE,AMHERST,N	 ,Home Health Aide,Nursing,Personal Care
"PEOPLE HOME HEALTH CARE SERVICES - LICENSED, INC.",BUFFALO,NY ,Erie, 716-874-5600, Voluntary Corporation,"PEOPLE HOME HEALTH CARE SERVICES-LICENSED, INC.",BUFFALO,N	 ,Home Health Aide,Medical Social Services,Nursing,Personal Care
"ROSEWOOD VILLAGE, INC.",HAMBURG,NY ,Erie, 716-649-7676, Proprietary Corporation,"ROSEWOOD VILLAGE, INC.",HAMBURG,N	 ,Home Health Aide,Medical Supplies Equipment and Appliances,Nursing,Personal Care,Therapy - Occupational,Therapy - Physical,Therapy - Speech Language Pathology
"SCHOFIELD HOME HEALTH CARE SERVICES, INC.",KENMORE,NY ,Erie, 716-873-7800, Voluntary Corporation,"SCHOFIELD HOME HEALH CARE SERVICES, INC.",KENMORE,N	 ,Home Health Aide,Nursing,Personal Care
"SIBLEY NURSING PERSONNEL SERVICES, INC.",CHEEKTOWAGA,NY ,Erie, 716-842-4108, Proprietary Corporation,"EXCELLUS ACQUISITION, INC.",ROCHESTER,N	 ,Home Health Aide,Nursing,Personal Care
TONAWANDA MANOR HOME CARE SERVICES,TONAWANDA,NY ,Erie, 716-871-1814, Proprietary Corporation,"BRAUNVIEW ASSOCIATES, INC.",TONAWANDA,N	 ,Home Health Aide,Nursing,Personal Care
UPSTATE HOME CARE,CHEEKTOWAGA,NY ,Erie, 716-565-2110, Proprietary Corporation,"INNOVATIVE SERVICES, INC.",CLINTON,N	 ,Medical Supplies Equipment and Appliances,Nursing,Therapy - Respiratory
VNA HOME CARE SERVICES,WILLIAMSVILLE,NY ,Erie, 716-630-8000, Voluntary Corporation,VNA HOME CARE SERVICES,WILLIAMSVILLE,N	 ,Home Health Aide,Medical Social Services,Medical Supplies Equipment and Appliances,Nursing,Nutritional,Personal Care,Therapy - Occupational,Therapy - Physical,Therapy - Respiratory,Therapy - Speech Language Pathology
"NORTH COUNTRY HOME SERVICES, INC.",TICONDEROGA,NY ,Essex, 518-585-9820, Voluntary Corporation,"NORTH COUNTRY HOME SERVICES, INC.",SARANAC LAKE,N	 ,Home Health Aide,Nursing,Personal Care
CAREGIVERS,MALONE,NY ,Franklin, 518-483-6205, Proprietary Corporation,"HOMEMAKERS OF WESTERN NEW YORK, INC.",BUFFALO,N	 ,Home Health Aide,Nursing,Personal Care
"NORTH COUNTRY HOME SERVICES, INC.",MALONE,NY ,Franklin, 518-483-4502, Voluntary Corporation,"NORTH COUNTRY HOME SERVICES, INC.",SARANAC LAKE,N	 ,Home Health Aide,Nursing,Personal Care
"NORTH COUNTRY HOME SERVICES, INC.",SARANAC LAKE,NY ,Franklin, 518-891-2641, Voluntary Corporation,"NORTH COUNTRY HOME SERVICES, INC.",SARANAC LAKE,N	 ,Home Health Aide,Nursing,Personal Care
"SARANAC LAKE VOLUNTARY HEALTH ASSOCIATION, INC.",SARANAC LAKE,NY ,Franklin, 518-891-0910, Voluntary Corporation,"SARANAC LAKE VOLUNTARY HEALTH ASSOCIATION, INC.",SARANAC LAKE,N	 ,Housekeeper,Nursing,Personal Care
FULTON COUNTY PUBLIC HEALTH,JOHNSTOWN,NY ,Fulton, 518-736-5720, Public,FULTON COUNTY,JOHNSTOWN,N	 ,Medical Social Services,Nursing,Nutritional,Therapy - Occupational,Therapy - Physical,Therapy - Speech Language Pathology
PINEVIEW COMMONS ALP,JOHNSTOWN,NY ,Fulton, 518-762-5488, Limited Liability Company,"PINEVIEW COMMONS, LLC",JOHNSTOWN,N	 ,Home Health Aide,Nursing,Personal Care
PINEVIEW COMMONS LIMITED LHCSA,JOHNSTOWN,NY ,Fulton, 518-762-5488, Limited Liability Company,"PINEVIEW COMMONS, LLC",JOHNSTOWN,N	 ,Nursing,Personal Care
VISITING NURSES HOME CARE,JOHNSTOWN,NY ,Fulton, 518-762-2410, Proprietary Corporation,VISITING NURSE ASSOC OF ALBANY HOME CARE CORP,ALBANY,N	 ,Home Health Aide,Nursing,Personal Care
HOME CARE &amp; HOSPICE,BATAVIA,NY ,Genesee, 585-343-7596, Voluntary Corporation,"COMMUNITY CARE OF WESTERN NEW YORK, INC.",OLEAN,N	 ,Audiology,Home Health Aide,Medical Social Services,Medical Supplies Equipment and Appliances,Nursing,Nutritional,Personal Care,Therapy - Occupational,Therapy - Physical,Therapy - Speech Language Pathology
VNA HOME CARE SERVICES,BATAVIA,NY ,Genesee, 585-344-2894, Voluntary Corporation,VNA HOME CARE SERVICES,WILLIAMSVILLE,N	 ,Home Health Aide,Medical Social Services,Medical Supplies Equipment and Appliances,Nursing,Nutritional,Personal Care,Therapy - Occupational,Therapy - Physical,Therapy - Respiratory,Therapy - Speech Language Pathology
"HOME SWEET HOME OF ATHENS, INC",ATHENS,NY ,Greene, 518-945-1673, Proprietary Corporation,"HOME SWEET HOME OF ATHENS, INC.",ATHENS,N	 ,Audiology,Home Health Aide,Homemaker,Housekeeper,Medical Social Services,Medical Supplies Equipment and Appliances,Nursing,Nutritional,Personal Care,Therapy - Occupational,Therapy - Physical,Therapy - Respiratory,Therapy - Speech Language Pathology
HOME SWEET HOME ON THE HUDSON,CATSKILL,NY ,Greene, 518-943-5701, Proprietary Corporation,"HOME SWEET HOME OF ATHENS, INC.",ATHENS,N	 ,Home Health Aide,Nursing,Personal Care
VISITING NURSES HOME CARE,CATSKILL,NY ,Greene, 518-943-5530, Proprietary Corporation,VISITING NURSE ASSOC OF ALBANY HOME CARE CORP,ALBANY,N	 ,Home Health Aide,Nursing,Personal Care
"HOME AIDE SVC. OF THE CENTRAL ADIRONDACKS, INC.",OLD FORGE,NY ,Herkimer, 315-369-6183, Voluntary Corporation,"HOME AIDE SERVICE OF THE CENTRAL ADIRONDACKS,INC.",OLD FORGE,N	 ,Home Health Aide,Nursing
SUPERIOR HOME HEALTH CARE,HERKIMER,NY ,Herkimer, 315-866-7932, Proprietary Corporation,THREE G'S INC.,MOHAWK,N	 ,Home Health Aide,Nursing,Personal Care
CAREGIVERS,WATERTOWN,NY ,Jefferson, 315-788-3269, Proprietary Corporation,"HOMEMAKERS OF WESTERN NEW YORK, INC.",BUFFALO,N	 ,Home Health Aide,Nursing,Personal Care
"FAMILY HOME CARE, INC.",WATERTOWN,NY ,Jefferson, 315-782-5475, Proprietary Corporation,"FAMILY HOME CARE, INC.",ROME,N	 ,Home Health Aide,Nursing,Personal Care
"SIBLEY NURSING PERSONNEL SERVICE, INC.",WATERTOWN,NY ,Jefferson, 315-782-9285, Proprietary Corporation,"EXCELLUS ACQUISITION, INC.",ROCHESTER,N	 ,Home Health Aide,Nursing,Personal Care
"1ST CHOICE HOME CARE SERVICES, INC.",BROOKLYN,NY ,Kings, 347-492-5982, Proprietary Corporation,"1ST CHOICE HOME CARE SERVICES, INC.",BROOKLYN,N	 ,Home Health Aide,Homemaker,Housekeeper,Medical Social Services,Nursing,Nutritional,Personal Care,Therapy - Occupational,Therapy - Physical,Therapy - Respiratory,Therapy - Speech Language Pathology
"A-LIFE SAVER HOME CARE SERVICES, INC.",BROOKLYN,NY ,Kings, 718-972-9792, Proprietary Corporation,"A-LIFE SAVER HOME CARE SERVICES, INC.",BROOKLYN,N	 ,Home Health Aide,Nursing,Personal Care
"ABUNDANT LIFE AGENCY, INC.",BROOKLYN,NY ,Kings, 718-735-7151, Proprietary Corporation,"ABUNDANT LIFE AGENCY, INC.",BROOKLYN,N	 ,Home Health Aide,Medical Social Services,Nursing,Personal Care,Therapy - Physical
"ACARE HHC, INC.",BROOKLYN,NY ,Kings, 347-462-4173, Proprietary Corporation,"ACARE HHC, INC.",BROOKLYN,N	 ,Home Health Aide,Nursing,Personal Care
ACCREDO,FLUSHING,NY ,Kings, 718-268-0423, Proprietary Corporation,"AHG OF NEW YORK, INC.",ELMSFORD,N	 ,Nursing
"AGELESS HOME HEALTH CARE, LLC",BROOKLYN,NY ,Kings, 718-646-3777, Limited Liability Company,"AGELESS HOME HEALTH CARE, LLC",BROOKLYN,N	 ,Home Health Aide,Medical Social Services,Nursing,Nutritional,Personal Care,Therapy - Occupational,Therapy - Physical,Therapy - Speech Language Pathology
ALJUD HOME CARE SERVICES,BROOKLYN,NY ,Kings, 718-649-0700, Partnership,ALFRED SCHONBERGER AND JUDITH SCHONBERGER,BROOKLYN,N	 ,Home Health Aide,Nursing,Nutritional,Personal Care,Physician Services,Therapy - Occupational,Therapy - Physical,Therapy - Respiratory,Therapy - Speech Language Pathology
"ALL CARE HOME HEALTH SERVICES, LLC",BROOKLYN,NY ,Kings, 347-996-6214, Limited Liability Company,"ALL CARE HOME HEALTH SERVICES, LLC",BROOKLYN,N	 ,Home Health Aide,Housekeeper,Nursing,Personal Care,Therapy - Occupational,Therapy - Physical,Therapy - Speech Language Pathology
ALL PRO HOME AND HEALTH CARE SERVICES,BROOKLYN,NY ,Kings, 718-284-7757, Proprietary Corporation,"ALL PRO HOME AND HEALTH CARE SERVICES, INC.",BROOKLYN,N	 ,Home Health Aide,Medical Social Services,Nursing,Nutritional,Personal Care,Therapy - Occupational,Therapy - Physical,Therapy - Respiratory,Therapy - Speech Language Pathology
"ALLIANCE FOR HEALTH, INC.",BROOKLYN,NY ,Kings, 718-875-8900, Proprietary Corporation,"ALLIANCE FOR HEALTH, INC.",BROOKLYN,N	 ,Home Health Aide,Nursing,Personal Care
ALTERNATE CHOICE HOME CARE,BROOKLYN,NY ,Kings, 718-336-9400, Individual,"CHARLOTTE WEIN, R.N.",BROOKLYN,N	 ,Home Health Aide,Nursing,Personal Care
"AMERICAN BIOMED HOMECARE, INC.",BROOKLYN,NY ,Kings, 718-235-8900, Proprietary Corporation,"AMERICAN ELECTRIC &amp; ELECTRONIC INSTRUMENTS, INC.",BROOKLYN,N	 ,Home Health Aide,Medical Supplies Equipment and Appliances,Nursing
AMERICAN HOPE HOME CARE SERVICES,BROOKLYN,NY ,Kings, 718-833-8314, Proprietary Corporation,AMERICARE HOME CARE SERVICES,BROOKLYN,N	 ,Home Health Aide,Nursing,Personal Care
AMERICARE OF NEW YORK CITY,BROOKLYN,NY ,Kings, 718-434-5100, Proprietary Corporation,"AMERICARE, INC.",BROOKLYN,N	 ,Home Health Aide,Medical Social Services,Medical Supplies Equipment and Appliances,Nursing,Personal Care,Therapy - Occupational,Therapy - Physical,Therapy - Respiratory,Therapy - Speech Language Pathology
"ANNE BLUE HOME HEALTH CARE AGENCY, INC.",BROOKLYN,NY ,Kings, 718-462-2020, Proprietary Corporation,"ANNE BLUE HOME HEALTH CARE AGENCY, INC.",BROOKLYN,N	 ,Home Health Aide,Nursing,Personal Care
ANR ADVANCE HOME CARE SERVICES,BROOKLYN,NY ,Kings, 718-332-9200, Proprietary Corporation,"CARING CARE OF NEW YORK, INC.",BROOKLYN,N	 ,Home Health Aide,Nursing,Personal Care,Therapy - Occupational,Therapy - Physical,Therapy - Speech Language Pathology
AT YOUR SIDE HOME CARE SERVICES,BROOKLYN,NY ,Kings, 718-646-0100, Limited Liability Company,"UNIVERSAL HEALTH CARE, LLC",BROOKLYN,N	 ,Home Health Aide,Homemaker,Housekeeper,Medical Social Services,Nursing,Personal Care,Therapy - Occupational,Therapy - Physical,Therapy - Speech Language Pathology
"ATTENDING HOME CARE, LLC",BROOKLYN,NY ,Kings, 718-940-9400, Limited Liability Company,"ATTENDING HOME CARE, LLC",BROOKLYN,N	 ,Home Health Aide,Homemaker,Nursing,Personal Care
